<?xml version="1.0" encoding="UTF-8"?>
<?xml-model href="RNG_Chroniques_froissart.rng" type="application/xml" schematypens="http://relaxng.org/ns/structure/1.0"?>
<?xml-model href="RNG_Chroniques_froissart.rng" type="application/xml" schematypens="http://purl.oclc.org/dsdl/schematron"?>
<!DOCTYPE TEI SYSTEM "DTD_chroniques_froissart.dtd">

<TEI xmlns="http://www.tei-c.org/ns/1.0">
    <teiHeader>
        <fileDesc>
            <titleStmt>
                <title>Chroniques</title>
                <author>Jehan Froissart</author>
                
            </titleStmt>
            <publicationStmt>
                <p> Edition encodée dans le cadre du master TNAH à l'Ecole Nationale des Chartes.</p>
            </publicationStmt>
            <sourceDesc>
                <listWit>
                    <head>Manuscrits médiévaux</head>
                        <witness xml:id="A">
                            <msDesc>
                                <msIdentifier>
                                    <placeName>
                                        <country>Etats-Unis</country>
                                        <settlement>Austin</settlement>
                                    </placeName>
                                    <institution>Université du Texas, Centre Harry Ransom</institution>
                                    <repository>Pre-1700 Manuscripts</repository>
                                    <idno>ms. 48</idno>
                                </msIdentifier>
                                <msContents>
                                    <textLang>Moyen français</textLang>
                                  </msContents>
                                <physDesc>
                                    <objectDesc form="manuscrit">
                                     <supportDesc>
                                      <support>Parchment</support>
                                      <extent>162 folios
                                      <dimensions unit="mm">
                                        <height>359</height>
                                        <width>286</width>
                                       </dimensions>
                                      </extent>
                                     </supportDesc>
                                     <layoutDesc>
                                      <layout columns="2">En deux colonnes</layout>
                                     </layoutDesc>
                                    </objectDesc>
                                    <decoDesc>
                                        <p>Ce manuscrit contient une grande miniature d'une scène de bataille, 
                                        deux petites miniatures (une représentant un chevalier à cheval et l'autre représentant une procession funéraire)
                                        et des lettres en capitales écrites en or sur fonds colorés.</p>
                                    </decoDesc>
                                   </physDesc>
                                   <history>
                                    <origin>
                                      <origDate>Entre 1425 et 1475</origDate>
                                    </origin>
                                  </history>
                            </msDesc>
                        </witness>
                        <witness xml:id="Be"> 
                            <msDesc>
                                <msIdentifier facs="https://memoirevive.besancon.fr/ark:/48565/6trchjnmkl20">
                                    <placeName>
                                        <country>France</country>
                                        <settlement>Besançon</settlement>
                                    </placeName>
                                    <institution>Bibliothèque municipale</institution>
                                    <repository>Manuscrits</repository>
                                    <idno>ms. 864</idno>
                                </msIdentifier>
                                <msContents>
                                    <textLang>Moyen français</textLang>
                                  </msContents>
                                <physDesc>
                                    <objectDesc form="manuscrit">
                                        <supportDesc>
                                        <support>Parchemin</support>
                                        <extent>830 folios
                                        <dimensions unit="mm">
                                            <height>360</height>
                                            <width>270</width>
                                        </dimensions>
                                        </extent>
                                        </supportDesc>
                                        <layoutDesc>
                                            <layout columns="2">En deux colonnes</layout>
                                        </layoutDesc>
                                    </objectDesc>
                                    <decoDesc>
                                          <p>Ce manuscrit contient 45 miniatures, des lettrines et des vignettes</p>
                                    </decoDesc>
                                   </physDesc>
                                   <history>
                                    <origin>
                                      <origDate>Entre 1410 et 1420</origDate>
                                    </origin>
                                  </history>
                            </msDesc>
                        </witness>
                        <witness xml:id="Br"> 
                            <msDesc>
                                <msIdentifier>
                                    <placeName>
                                        <country>Belgique</country>
                                        <settlement>Bruxelles</settlement>
                                    </placeName>
                                    <institution>Bibliothèque royale de Belgique</institution>
                                    <repository>Manuscrits</repository>
                                    <idno>ms. II 88</idno>
                                </msIdentifier>
                                <msContents>
                                    <textLang>Moyen français</textLang>
                                  </msContents>
                                <physDesc>
                                    <objectDesc form="manuscrit">
                                     <supportDesc>
                                      <support>Parchemin</support>
                                      <extent>23 folios
                                      <dimensions unit="mm">
                                        <height>385</height>
                                        <width>285</width>
                                       </dimensions>
                                      </extent>
                                     </supportDesc>
                                    </objectDesc>
                                   </physDesc>
                                   <history>
                                    <origin>
                                      <origDate>Entre 1400 et 1450</origDate>
                                    </origin>
                                  </history>
                            </msDesc>
                    </witness>
                    <witness xml:id="C">
                        <msDesc>
                            <msIdentifier>
                                <placeName>
                                    <country>Etats-Unis</country>
                                    <settlement>Chicago</settlement>
                                </placeName>
                                <institution>Library of Chicagp</institution>
                                <repository>Special collections, manuscripts</repository>
                                <idno>folio Case MS 37.1</idno>
                            </msIdentifier>
                            <msContents>
                                <textLang>Moyen français</textLang>
                              </msContents>
                            <physDesc>
                                <objectDesc form="manuscrit">
                                 <supportDesc>
                                  <support>Parchemin</support>
                                  <extent>282 pages
                                      <dimensions unit="mm">
                                          <height>370</height>
                                          <width>265</width>
                                      </dimensions>
                                  </extent>
                                 </supportDesc>
                                 <layoutDesc>
                                    <layout columns="2">En deux colonnes</layout>
                                </layoutDesc>
                                </objectDesc>
                                <handDesc>
                                    <p>Ecrit par trois mains du 15ème siècle</p>
                                   </handDesc>
                               </physDesc>
                               <history>
                                <origin>
                                  <origDate>Entre 1425 et 1450</origDate>
                                </origin>
                              </history>
                        </msDesc>
                    </witness>
                </listWit>
            </sourceDesc>
        </fileDesc>

        <profileDesc>
            <!-- liste des noms et lieux rencontrés dans le texte -->
            <particDesc>
                <listPerson>
                    <person xml:id="Anglais">
                        <persName xml:lang="frm">Anglois</persName>